{"schema_version":"x07.mcp.replay.session@0.2.0","generated_at":"2026-04-08T15:32:01.483921000Z","tool":"hardproof","tool_version":"0.4.0-beta.2","target":{"kind":"mcp_server","meta":{},"ref":"http://127.0.0.1:8403/mcp","transport":"streamable_http"},"ok":true,"errors":[],"warnings":[],"details":{"scenario":"smoke/basic","http_session":{"base_url":"http://127.0.0.1:8403","id":"smoke.basic","mcp_path":"/mcp","profile":"record","project_files":{},"schema_version":"x07.mcp.rr.http_session@0.1.0","steps":[{"name":"initialize","req":{"body_json":{"id":1,"jsonrpc":"2.0","method":"initialize","params":{"capabilities":{},"protocolVersion":"2025-11-25"}},"headers":{"Accept":"application/json, text/event-stream","Content-Type":"application/json","MCP-Protocol-Version":"2025-11-25","Origin":"http://localhost:3000"},"method":"POST","path":"/mcp"},"res":{"body_json":{"id":1,"jsonrpc":"2.0","result":{"capabilities":{"logging":{},"tools":{"listChanged":false}},"protocolVersion":"2025-11-25","serverInfo":{"name":"io.x07/postgres-mcp","version":"0.1.0"}}},"headers":{"MCP-Session-Id":""},"status":200}},{"name":"initialized_notification","req":{"body_json":{"jsonrpc":"2.0","method":"notifications/initialized","params":{}},"headers":{"Accept":"application/json, text/event-stream","Content-Type":"application/json","MCP-Protocol-Version":"2025-11-25","MCP-Session-Id":"","Origin":"http://localhost:3000"},"method":"POST","path":"/mcp"},"res":{"body_empty":true,"headers":{},"status":202}},{"name":"tools_list","req":{"body_json":{"id":2,"jsonrpc":"2.0","method":"tools/list","params":{}},"headers":{"Accept":"application/json, text/event-stream","Content-Type":"application/json","MCP-Protocol-Version":"2025-11-25","MCP-Session-Id":"","Origin":"http://localhost:3000"},"method":"POST","path":"/mcp"},"res":{"body_json":{"id":2,"jsonrpc":"2.0","result":{"tools":[{"annotations":{"idempotentHint":true,"readOnlyHint":true},"description":"Check database liveness in deterministic stub mode.","inputSchema":{"additionalProperties":false,"properties":{},"type":"object"},"name":"db.ping"},{"annotations":{"idempotentHint":true,"readOnlyHint":false},"description":"Run a deterministic query stub and return rows.","inputSchema":{"additionalProperties":false,"properties":{},"type":"object"},"name":"db.query"},{"annotations":{"idempotentHint":true,"readOnlyHint":true},"description":"Conformance fixture: emits progress notifications and returns text.","inputSchema":{"additionalProperties":false,"properties":{},"type":"object"},"name":"test_tool_with_progress"}]}},"headers":{},"status":200}}]}}}
